{
  "schema_version": "1.0",
  "asset_id": "asset-web-001",
  "tenant_id": "tenant-demo",
  "name": "Demo storefront",
  "asset_type": "web_application",
  "environment": "staging",
  "owner_team": "team-p3",
  "criticality": "high",
  "tags": [
    "demo",
    "web"
  ],
  "authorization": {
    "status": "approved",
    "approved_by": "security-owner-demo",
    "approved_at": "2026-10-20T09:00:00Z",
    "expires_at": "2026-12-31T23:59:59Z",
    "allowed_targets": [
      "https://staging.example.com"
    ],
    "excluded_targets": [
      "https://staging.example.com/admin"
    ],
    "rules_of_engagement_ref": "roe-demo-v1"
  },
  "created_at": "2026-10-20T09:00:00Z",
  "updated_at": "2026-10-20T09:00:00Z"
}
